{
  "format": "drawio-evidence-catalog/v1",
  "reviews": [
    {
      "id": "d023e57e02b0893d6baea136d1b1bcafb69c0133a804e8f3a0073864ffd93a28",
      "title": "example-blueprint",
      "repository": null,
      "source_path": "architecture/commerce-platform.json",
      "revision": "677a6995aea61597be8c20021d58a2e2b26c63dd0dc130db270bdc4494918318",
      "revision_type": "bundle",
      "review_sha256": "4e033384506a72d29cb0217ab74f6a305fcf9848cc78b63b2509dd1ac043f00c",
      "attestation_sha256": "663398078a79f6227b34d2cd0675c0dea741e86ffb710d0ba3d8dfeb7dc9dd7f",
      "bundle_sha256": "677a6995aea61597be8c20021d58a2e2b26c63dd0dc130db270bdc4494918318",
      "source_url": null,
      "gates": {
        "audit": true,
        "security": true,
        "extraction": true,
        "policy": true,
        "ownership": true
      },
      "passed": true
    }
  ],
  "summary": {
    "repositories": 1,
    "reviews": 1,
    "passed": 1,
    "needs_review": 0
  },
  "baseline": null
}
